{
  "name": "editorial-select",
  "palette": {
    "paper": "#EEEEEE",
    "paper-grid": "#E8E9E9",
    "grid-rule": "#D2D2D2",
    "ink": "#0A0A0A",
    "ink-soft": "#1B1917",
    "ink-grey": "#343434",
    "ghost": "#E1E1E1",
    "type-light": "#F4F1EC",
    "violet": "#A27AE7",
    "lavender": "#C4ADE4",
    "rose": "#755753",
    "clay": "#A7887C",
    "mist": "#BEB9BB",
    "night": "#1F1C1B",
    "steel-blue": "#395B7F",
    "orchid": "#CF83B5",
    "moss": "#475E31"
  },
  "type": {
    "family": "\"ES Serif\", Georgia, serif",
    "weights": [
      400
    ],
    "scale": {
      "ghost": 928,
      "rise": 478,
      "behind": 348,
      "launch": 268,
      "shout": 159,
      "title": 148,
      "line": 116,
      "word": 116,
      "statement": 58,
      "lockup": 43,
      "end": 38,
      "fine": 17
    },
    "tracking": {
      "title": 0,
      "line": 0,
      "statement": 0,
      "wide": 0.3,
      "pixel": -0.02,
      "grotesk": -0.02,
      "bitmap": -0.04
    },
    "leading": {
      "ghost": 0.8,
      "title": 1.0,
      "line": 1.05,
      "statement": 1.1
    }
  },
  "spacing": {
    "margin": 64,
    "gap": 32,
    "chip": 24,
    "chip-grow": 26,
    "chip-fine": 8,
    "chip-offset-x": 34,
    "chip-offset-y": 59,
    "grid-x": 120,
    "grid-y": 121.5,
    "print-border": 30
  },
  "timing": {
    "unit_ms": 62.5,
    "durations": {
      "snap": 4,
      "word-hold": 9,
      "beat": 7.056,
      "push": 8.67,
      "drift": 13.33,
      "pull": 40,
      "reveal": 11.33,
      "hold-long": 18
    }
  },
  "easings": {
    "snap": [
      0.33,
      1,
      0.68,
      1
    ],
    "drift": [
      0.15,
      0.11,
      0.614,
      0.796
    ],
    "drift-linear": [
      0.385,
      0.326,
      0.732,
      0.781
    ],
    "push": [
      0.336,
      -0.065,
      0.0,
      0.821
    ],
    "push-hard": [
      0.772,
      0.446,
      0.15,
      0.453
    ],
    "pull": [
      0.924,
      0.668,
      0.604,
      0.958
    ],
    "glide": [
      0.034,
      0.665,
      0.702,
      1.023
    ],
    "reveal": [
      0.081,
      -0.525,
      0.0,
      0.951
    ],
    "rise": [
      0.15,
      0.85,
      0.3,
      1
    ],
    "pass": [
      0.45,
      0.05,
      0.55,
      0.95
    ],
    "settle": [
      0.42,
      0.543,
      1.0,
      1.076
    ]
  }
}